title,content,url
"Feds: Massachusetts pizzeria chain owner sentenced for forced labor, deportation threats","The owner of a Massachusetts pizzeria chain was sentenced to more than eight years in prison for physically abusing six employees and threatening them with further violence and deportation if they did not comply with his ""excessive workplace demands,"" federal authorities announced. Stavros Papantoniadis, also known as Steve Papantoniadis, was handed an eight-and-a-half-year sentence in a District of Massachusetts courtroom months after being found guilty of three counts of forced labor and three counts of attempted forced labor, according to a Justice Department news release. “Labor trafficking exploits the vulnerable through fear and intimidation, all in pursuit of the almighty buck. That is what Stavros Papantoniadis did when he violated the rights of the people working in his restaurants. He deliberately hired foreign nationals who lacked authorization to work in the United States and then turned their lack of immigration status against them, threatening them with deportation and violence to keep them under his control,” U.S. Attorney Joshua S. Levy said in the release. Steven C. Boozang, Papantoniadis' attorney, told USA TODAY that his client was a ""pillar of the community"" and had no quarrels with any of the hundreds of people he's previously employed since he began his business over 32 years ago. ""He had done a lot for the community,"" Boozang said. Lawsuit: Ohio nursing home didn't tell family about fatal pressure wound The 49-year-old from Westwood, Massachusetts forced or attempted to force five men and one woman to do excessive labor at his shop, Stash's Pizza, by abusing them and repeatedly threatening to contact immigration authorities, according to the Justice Department. Federal prosecutors said Papantoniadis ""thinly staffed"" his two Stash's Pizza locations, in Dorchester and Roslindale, on purpose and employed individuals without immigration status to work for 14 hours or more a day for up to seven days a week. One of the employees would work between 84 and 119 hours per week, according to a federal complaint obtained by USA TODAY. In addition to threatening the workers with physical harm and deportation, Papantoniadis monitored them with surveillance cameras and ""constantly demeaned, insulted and harassed them,"" according to the Justice Department. When Papantoniadis learned one of the workers planned on quitting, he ""violently choked him,"" federal authorities said. When other workers told Papantoniadis they intended to quit, the owner told one of them that ""he would kill him"" and call immigration authorities, while he threatened another by telling him he knew where he lived, the Justice Department said. Another worker told authorities that Papantoniadis chased him down Route 1 in Norwood, Massachusetts and falsely reported him to local police so he would return to work at the pizza shop, according to the release. Boozang said the allegations the six workers brought against Papantoniadis were ""extremely suspect"" for several reasons, including the Stash's Pizza owner paying for their vacations, buying their kids Christmas gifts and even paying for one of their weddings. In addition to the things Papantoniadis allegedly did for the six workers, Boozang said he found it odd that no previous employees had complained about his client. ""(Papantoniadis) has had hundreds and hundreds of employees over the years, many who have come back,"" according to the attorney. Papantoniadis also paid the six workers up to $17 an hour for the 70-hour work weeks, which they requested, Boozang said. ""He gave them what they wanted,"" Boozang said. The U.S. Department of Labor, Wage and Hours Division (DOL-WHD) brought a civil case against Papantoniadis on March 24, 2017, for ""overtime wage violations,"" according to court documents. The civil suit was resolved on March 27, 2019, and five out of the six workers who were a part of the criminal case received compensation for back wages and liquidated damages through Papantoniadis' settlement with the DOL-WHD, court records say. Boozang said the forced labor allegations against Papantoniadis ""came out of the woodwork,"" and that the six workers ""read the script."" Although Boozang's suspicions were raised during Papantoniadis' trial, a jury found his client guilty in June. ""Papantoniadis exploited and abused his employees, denying them the basic dignity every person deserves,"" Michael J. Krol, Special Agent in Charge for Homeland Security Investigations in New England, said in the release. ""Today’s significant sentence sends a message to employers — employees deserve to work in safety, free from harassment and abuse and exploitative employers will be held to account.""",https://eu.usatoday.com/story/news/nation/2024/10/28/stavros-steve-papantoniadis-stashs-pizza/75895709007/
Ohio family files lawsuit against nursing home after woman's pressure wound death,"An Ohio woman’s family has filed a lawsuit against the nursing home she was treated at after she developed a pressure wound that became infected and ultimately killed her. The nursing home is located in Oregon, a northwest Ohio city just outside of Toledo. Lucy Garcia, 72, was admitted to Arbors at Oregon on Jan. 25, 2023 for long term residential care after having a stroke, according to a lawsuit filed Wednesday afternoon in Lucas County. She died nearly a year-and-a-half later on July 2, 2024 due to a pressure ulcer that became infected, leading to sepsis. The Lucas County Coroner performed an autopsy on Garcia and reviewed her medical records from St. Charles Medical Center and Arbors at Oregon. The coroner ruled her manner of death homicide, and an autopsy report obtained lists her death as the result of “caretaker neglect resulting in complications of a sacral pressure wound.” Matt Mooney, an attorney representing the Garcia family, filed the lawsuit on the family’s behalf and said the filing is “the first step towards bringing Lucy Garcia’s killers to justice.” Read more: Ohio family says they plan to sue nursing home after matriarch's death ruled a homicide Citing medical negligence and recklessness, the lawsuit blames the facility for Garcia’s death and calls for at least $25,000 in damages plus attorney’s fees and other expenses. “We will stop at nothing to hold the Arbors and its corporate controllers accountable for creating a system of putting profits over people - a system that they knew caused horrific injuries and death to their residents like Lucy,” Mooney wrote in a statement to USA TODAY on Friday. Arbors at Oregon did not immediately respond to requests for comment. Garcia’s stroke had made her heavily reliant on the workers at Arbors at Oregon, her family alleged in the lawsuit. The stroke took a toll on her left side, primarily her left arm, and doctors were aware that she needed help getting in and out of bed, moving around in bed and getting to the bathroom. The facility told the Garcia family that staff would be able to care for their matriarch’s needs. “Arbors at Oregon represented to Lucy’s family that they had sufficient numbers of well trained, qualified, and compassionate nursing staff to provide appropriate care to Lucy and all the other residents under their care,” the lawsuit read. But employees there knew resident needs could not be met and other patients had suffered from injuries such as bedsores, infections, falls and in Garcia’s case, death, the lawsuit alleges. According to the Garcia family’s lawsuit, the facility did not have enough staff members to properly care for residents, and the staff members that were there had not received the proper training, nor were they “compassionate to the needs and rights of the residents,” the lawsuit reads. The lawsuit also alleges that the facility had been investigated for multiple health and safety violations and failed to let Garcia’s family know about the violations, including recent criminal neglect and abuse accusations against nursing staff that led to the death of one patient. While Garcia needed help to do so, she could use the restroom, the lawsuit alleged. Rather than help her to the restroom, staff at Arbors at Oregon put her in adult diapers and told her staff would come and “clean her up” once she soiled herself. She was often left in soiled diapers for extended periods of time, “exposing her skin to her own bodily waste – which resulted in breakdown of the skin on her buttocks,” the lawsuit read. The day after she was admitted to Arbors at Oregon, staff completed an assessment to determine the likeness of her developing pressure or bedsores. She scored a 13, meaning she was at a moderate risk for developing bedsores. To prevent the sores, Garcia needed to be turned and repositioned regularly in bed, but her family alleges Arbors at Oregon’s staff did not do this. Staff first noted that Garcia developed a sore on March 5 this year. Just 8 days later, Arbors at Oregon noted that the “abrasion” had grown and a photo was taken, the lawsuit alleged. The sore developed “in-house,” according to the lawsuit. Staff referred to the sore as an “abrasion.” When skilled nursing facilities have patients who develop bedsores, they must report the bedsores to the Centers for Medicare, which may negatively impact the facility’s quality measures rating, the lawsuit read. According to the Garcia family’s lawsuit, someone at Arbors at Oregon told staff to log bed sores as different types of wounds so the facility’s quality measures score would not be impacted. The family argued that this allowed the facility to dupe members of the public into believing their loved ones would be properly cared for at the facility. By March 25, Arbors at Oregon’s nursing staff had noted that the sore was “resolved” despite it still being visible on her backside, the lawsuit read. There were also discrepancies in her file regarding when the wound began to develop. According to the lawsuit, the facility did not document the wound as a pressure wound until June 13, just over 3 months after it first developed. Her family still hadn’t been told about the pressure wound. On June 19, Arbors at Oregon contacted the Garcia family and told them Garcia was nearing the end of her life, and said she needed to be put in hospice care. Her family came to visit and found her barely responsive, their lawyer wrote in the lawsuit. Garcia’s sons told facility staff that Garcia was recently feeling well enough to go to church. They didn’t understand how things could deteriorate so quickly, according to the lawsuit. Facility staff did not tell the family what happened, nor did they tell her about the wound, the document read. Garcia’s other family members in her room noticed an odor coming from her, then turned her over and saw a loose bandage on her backside that was beginning to peel back. There, they saw her bedsore, which had pus coming from it, the lawsuit read. Family members pushed for her to go to the hospital but the facility was hesitant. Eventually, Arbors at Oregon called an ambulance and Garcia was taken to the hospital. Doctors removed the bandages on her backside and found that she had a Stage 4 bedsore. “All the tissue on her backside down to her bone had died off, including muscle,” the lawsuit read. “The open bedsore was exposed to Lucy’s own feces and urine from Arbors at Oregon leaving her in soiled adult diapers, and the wound was infected with bacteria causing sepsis – a systemic infection of Lucy’s body.” The wound was so deep that bones in Garcia’s back were exposed, the lawsuit read. Doctors treated her with IV antibiotics and cleaned the wound. However, she died on July 2. The Garcia family and their lawyer argued in the lawsuit that she died “as a direct and proximate result of the negligence/recklessness” the nursing home showed when caring for her. Mooney, the family’s lawyer, previously told USA TODAY that Garcia had a large family. She was a single mother, raised four boys and was also a “motherly figure to all the kids in the neighborhood.” She was known to let people stay at her house for the night if they needed it, he said. “Her family really viewed her as the center of their family unit, and she was included in just about every single one of her grandchildren and great-grandchildren's births,” Mooney told USA TODAY in September. She leaves behind four sons, 17 grandchildren and nine great-grandchildren. This story has been updated to clarify the amount the family is requesting in damages. Saleen Martin is a reporter on USA TODAY's NOW team. She is from Norfolk, Virginia – the 757. Follow her on Twitter at @SaleenMartin or email her at sdmartin@usatoday.com.",https://eu.usatoday.com/story/news/nation/2024/10/28/lucy-garcia-ohio-pressure-wound-lawsuit/75844371007/
What should parents really be worried about this Halloween? Not razors in candy.,"As Halloween approaches, tips often circulate advising parents to check their children's Halloween candy, not for a tasty caramel center, but for potentially unsafe objects — like razor blades. But this year, experts are urging parents and caregivers to be mindful of other, more common, Halloween dangers, like vehicle traffic and food allergies. On average, children are more than twice as likely to get hit by a car while trick-or-treating than any other day, Safe Kids Worldwide, an international nonprofit dedicated to child safety, reports. Here's what adults and children should know before trick-or-treating on Thursday. To help keep kids safe from traffic incidents while traversing streets on Halloween night, Safe Kids Worldwide provides the following tips: The nonprofit also advised parents to think about what types of face coverings their children are wearing, as masks can obstruct a child's vision while walking. Food allergies can also be a dangerous around the Halloween season. The Food and Drug Administration (FDA) advises parents who have children with allergies to check candy labels to ensure allergens aren't present. Parents should also never allow children to eat homemade baked goods they may have received. Generally, children should also never accept or eat items that are not commercially wrapped, the FDA advises. If parents are concerned about potential tampering, they should look for unusual wrapper appearances or discoloration, tiny pinholes, or tears in wrappers. In an effort to aid children navigating food allergies, Food Allergy Research & Education (FARE) created the Teal Pumpkin Project. The project encourages households to offer non-food items to trick-or-treaters so allergens may be avoided altogether. FARE recommends items like glow sticks, bubbles, bouncy balls, finger puppets, playing cards, stickers and other Halloween toys as non-food item options. Those looking to participate should visit the FARE website, where they can add their address to the Teal Pumpkin Project Map and find resources for how to let neighbors know. Fear-mongering about dangerous items, like razor blades and poison, in Halloween candy dates back to the 1960s. In October 1964, a New York woman was arrested for handing out ant poison and dog treats to trick-or-treaters, according to the History Channel. When she was questioned, the woman said she had only been joking and gave out these items to children she believed were too old to be trick-or-treating. Fortunately, no children were poisoned. Perhaps the most notable Halloween poisoning took place in October 1974, when a Texas man named Ronald O'Bryan handed out ""cyanide-laced pixie sticks"" to five trick-or-treaters, including his own son, according to the History Channel. Only O'Bryan's son ate the candy and he died soon after. No one saw O'Bryan lace the pixie sticks, but investigators learned that he had pulled out life insurance policies on his children. He was convicted of murder and executed via lethal injection in 1984, according to the History Channel. University of Delaware Sociology professor Joel Best has studied these instances of dangerous items placed in Halloween candy, which he calls ""Halloween Sadism,"" for decades. In 1985, he co-authored ""The Razor Blade in the Apple: The Social Construction of Urban Legends,"" a research article that largely discusses the history of dangerous treats given to children on Halloween. Continuing his research on the topic, Best stated between 1959 and 2012, 85 incidents of ""Halloween Sadism"" have been reported in the United States, per his website. A recent example occurred in 2015, when an Ohio child found a disposable razor blade in a Snickers candy bar received while trick-or-treating, per previous USA TODAY reporting. The child, and others in the area, were fortunately not hurt. Greta Cross is a national trending reporter at USA TODAY. Follow her on X and Instagram @gretalcross. Story idea? Email her at gcross@gannett.com.",https://eu.usatoday.com/story/news/nation/2024/10/28/halloween-safety-trick-or-treating-traffic-food-allergies/75892063007/
Bear attack or murder? Bizarre 911 call leads to manhunt in Tennessee,"KNOXVILLE, Tenn. − A manhunt was underway Monday for a slaying suspect who police say used a bogus identity when he made a bizarre 911 call claiming he fell off a cliff while running from a bear near the scenic Cherohala Skyway in rural southeast Tennessee. The call came in on Oct. 18 from near Tellico Plains, Tennessee, about 50 miles southwest of Knoxville in the foothills of the Great Smoky Mountains. The caller identified himself as Brandon Andrade and said he hit his head and could not move his legs. Monroe County Sheriff Tommy Jones said first responders descending on the scene found a man's body and Andrade's ID. Detectives determined the victim was not Andrade and had been murdered, Jones said. Ten days later the identity of the victim remains a mystery. Sheriff's detectives discovered the ID had been stolen and used several times by Nicholas Hamlett, 45, who was wanted by police in Alabama for a parole violation. Jones said Hamlett used another false name when speaking with detectives after the 911 call. By the time his real identity had been verified, Hamlett had fled the area, Jones said. FBI search: Man said a bear chased him off a cliff when he called 911 An arrest warrant charging first-degree murder has been issued for Hamlett, Jones said in a news release issued Friday. ""Mr. Hamlett is considered armed and dangerous,"" Jones warned. ""If you see Mr. Hamlett, please call 911."" Tellico Plains is on the 43-mile Cherohala Skyway that passes through the Cherokee National Forest, which is federal land and runs to Robbinsville, North Carolina. The Knoxville News Sentinel, part of the USA TODAY Newtork, obtained recordings of the call being relayed by dispatch. “Units en route to the area of Cherohala Skyway at Falls Branch Road. Have a male subject that fell off a cliff. He is unable to move. He was running from a bear. He has 2% battery – unable to get him back on 911. ... Not able to move his legs. Did hit his head. He’s going to be at the falls …” The FBI, state and local authorities are now looking for Hamlett − and for the identity of the victim. The sheriff's office said Monday that there were no updates on the case and that a briefing was planned for Wednesday. John Bacon reports for USA TODAY Tyler Whetstone reports for the Knoxville News Sentinel.",https://eu.usatoday.com/story/news/nation/2024/10/28/bear-attack-murder-911-call-tennessee/75892344007/
Boo-tiful weather? See what your 2024 Halloween forecast has in store,"You've got the candy, costumes and decorations all ready. Now will the weather cooperate for your Halloween celebrations? Here's how the weather will affect the goblins, ghosts and ghouls in your neighborhood on Halloween evening: The nation's two soggiest spots on Halloween − Thursday − will likely be in portions of the central U.S. and the much of the Northwest. And though warmth will make news in some areas, what will be missing is widespread cold, forecasters said: ""This year, there are no major concerns as far as snow, ice or cold across much of the country,"" AccuWeather meteorologist Paul Pastelok said in an online forecast. ""A cold front will sweep across the central U.S. mid to late week, bringing the chance of rain from the Great Lakes to the Mississippi Valley on Halloween,"" said Weather.com meteorologist Caitlin Kaiser in an online forecast. Pastelok added that ""thunderstorms can occur from Houston northward to Little Rock and Memphis, Tennessee,"" noting that multiple showers and thunderstorms in this region may warrant bringing an umbrella for trick-or-treating or even taking shelter indoors. Farther north, he said rain may dampen festivities in parts of the Ohio Valley and Great Lakes region, including in Detroit and Cleveland. However, according to the Storm Prediction Center, the threat for severe weather appears ""marginal"" as of Monday. While portions of the central U.S. dodge raindrops, the main weather story for folks along the Eastern Seaboard will be the unusual, potential record-breaking warmth. How warm? High temperatures Thursday are expected to range from the 70s in New England to near 80 degrees across much of the Mid-Atlantic, AccuWeather predicts. According to Kaiser, ""h​igh temperatures could approach daily records in some Northeast cities, including Albany, New York, Hartford, Connecticut, and Trenton, New Jersey."" The Southeast will see above-average warmth as well: ""People may need to bring fans with them in Raleigh and Charlotte as temperatures will start in the 80s for trick-or-treating and fall back into the 70s,"" Pastelok said. The dreariest, chilliest spot on Halloween night is likely to be the Pacific Northwest, where rain or even high-elevation snow is possible, AccuWeather said rain and cool temperatures from a sweeping cold front could produce a double whammy in Seattle and Portland, forcing some costumes under jackets. Snow is even possible in the mountains: ""The higher elevations in the Northwest, above 2,000 feet, can experience some tricks from Mother Nature with wintry conditions,"" Pastelok said. In the Southwest, AccuWeather says there will be no weather-related concerns as kids and adults fill the neighborhood streets.",https://eu.usatoday.com/story/news/nation/2024/10/28/halloween-weather-2024-forecast/75891949007/
