title,content,url
"Ballot boxes burned, hundreds of votes destroyed in Washington, Oregon arson cases","Two ballot boxes were burned in Washington and Oregon on Monday, possibly damaging hundreds of mail-in votes with only about a week to go before Election Day. The Portland Police Bureau responded to reports of a fire in the Buckman neighborhood of the city at about 3:30 a.m. The fire had been extinguished by security personnel who work in the area, and officers soon found an ""incendiary device,"" characterizing the crime as arson. The Vancouver Police Department in nearby southern Washington said in a statement that they responded to an arson at a ballot box at 4 a.m. They found smoke coming out of the box and a ""suspicious object"" next to it. The Federal Bureau of Investigation said in a statement to USA TODAY that it is ""coordinating with federal, state and local partners to actively investigate the two incidents."" The FBI declined to comment on whether the arsons would be investigated as a domestic terror incident in a follow-up email. Clark County auditor Greg Kimsey said that a large number of ballots had been destroyed in the Vancouver fire at a joint press conference. ""We are still in the process of coming up with a closer number, but it certainly was hundreds,"" Kimsey said. Kimsey said that the fire suppression system in the Vancouver ballot box did not work. The last pick-up from the ballot box occurred at 11 a.m. Saturday, Kimsey told USA TODAY in an interview. Kimsey said that voters who believe their ballot was in the box when the fire occurred can request a new ballot at the county's voting website. He further said that there will be increased police and civilian security around the drop boxes and ballot pick-ups will occur at 5:30 p.m. Multnomah County election official Tim Scott said in the press conference that only three ballots had been destroyed in the Portland fire and that those voters would be contacted. The boxes that were burned are located about 15 miles away from each and police officials said that they believe the arsons are connected. Vancouver police said that Monday's arson was similar to one that occurred Oct. 8 before ballots were being mailed, according to The Oregonian. The Vancouver ballot box is located in Washington’s 3rd Congressional District, where Democratic House Rep. Marie Gluesenkamp Perez is attempting to retain her seat, which she won by less than 3,000 votes in 2022 against Republican challenger Joe Kent. Both candidates condemned the arsons on Monday. ""Southwest Washington cannot risk a single vote being lost to arson and political violence,"" Gluesenkamp Perez said in a statement. ""We can’t yield to intimidation, and we must continue to stand up against unpatriotic acts such as this one. ""Stay focused on driving voter turn out & early voting, don’t be deterred from voting by a cowardly act of terrorism,"" Kent said on X. This story has been updated with new information.",https://eu.usatoday.com/story/news/nation/2024/10/29/ballots-destroyed-arson-fires-portland-washington/75901758007/
"Creepy crawly spiders coming into your home? Don't kill them, experts say.","Fall is the time of year when homeowners may be noticing more spiders scurrying across their kitchen floors and setting up camp by weaving complex webs in the dark corners of their basements. Turns out, that as temperatures drop, our houses and the heating they provide are ideal places for eight-legged arachnids to find shelter, look for mates and hunt for prey to eat. Of course, unless you're an arachnologist, there's a good chance you don't particularly care to share your living space with the creepy crawlers. The urge to grab the nearest shoe, book or other flat object to squish any spider you see may be hard to resist. But many experts – yes, even pest control businesses – caution homeowners to exercise a little restraint. Here's why you may be noticing more spiders in your house, and why you should reconsider killing them. Though spiders are abundant from spring through fall across the United States, experts warn that more may be noticed inside our homes when temperatures start to drop and they seek out warm spaces to take shelter for the winter. Fall is also the time of year that most arachnids reach maturity and are full-grown, which may account for why you're noticing them more often. Our homes are rife with window sills and other small crevices in which spiders can hide, while trash cans and compost bins provide a plentiful food source of scavenging insects, said Lisa Gonzalez, a program manager at the Natural History Museum of Los Angeles County, home to the spider pavilion where about 300 spiders of up to 15 species live. What's more, structures like houses provide plenty of sturdy attachment points for their webs. That is to say, our homes are great places for spiders to live, which means it's also where they're going to reproduce. Late summer and early fall is typically when male webspinners, hoping to put their newly-developed sex organs to the test, leave their webs in search of female mates, said Anne Danielson-Francois, associate professor of biological sciences at the University of Michigan-Dearborn. The female spiders, depending on species, typically conserve their energy and remain at their spun homes, waiting on the males to come to them. ""They are not necessarily more abundant than in the summertime, but individuals are more visible because they are larger,"" Danielson-Francois said. ""A small web might go unnoticed in your kitchen window, but once that spider has grown to full size and spins a web that covers a quarter of the window, you could not miss it."" The rule of thumb, experts say, should be this: If the spider isn't bothering you, then don't bother it. ""If you can allow an eight-legged roommate, it can benefit you,"" Danielson-Francois said. ""And they provide free Halloween decorations for your home, wherever you prefer them – inside or out."" So, what is the benefit of a mutual existence with a creature whose mere sighting inside a home sends many fleeing from the room? It's because spiders are predators that keep insect populations in check. If left alone spiders provide free pest control, eating more obnoxious pests such as flies, said Allen Lawrance, associate curator of entomology at the Peggy Notebaert Nature Museum located in Chicago and operated by the Chicago Academy of Science. Even companies who make a profit by eliminating unwanted pests recommend that home owners leave spiders alone. On its website, Orkin touts the advantages of having some of the creepy-crawlers around, writing that the arachnids can keep away (or feed on) pests that are actually harmful, like disease-carrying ticks and fleas. ""Spiders are also extremely beneficial to our ecosystem and control the number of bugs that destroy plants and crops, which is why scientists ask us not to kill them,"" Orkin writes. In its own post, Romney Pest Control largely agreed, adding that the presence of dangerous spiders such as the brown recluse spider, whose bite often requires medical treatment, may require contacting a professional. Arachnologists do acknowledge that many people are fearful of spiders and may not want them around. But there's no need to burn your house down to rid yourself of the critters. The important thing, though, is to remember that most species of spiders commonly found inside homes – like cobweb spiders and cellar spiders (better known as ""daddy longlegs"") – are not dangerous. ""While all spiders do produce some venom to help capture and consume their prey, none of these pose any real threat to humans,"" Lawrance said. While seeing spiders on a regular basis may be a sign of an infestation requiring professional help, a stray spider here or there is no cause for concern. But for those who just can't bring themselves to tolerate the presence of spiders, they have a few options recommended by arachnologists and pest control companies alike: ""Don’t feel bad for the spider, they can survive outside quite well,"" Danielson-Francois said. ""With substances in their blood that act like antifreeze, some species can overwinter under tree bark or in leaf litter just fine."" Even Gonzalez said she removes widow spiders, which have venom that can cause problematic reactions if they bite, from her mailbox and underneath patio furniture. ""Every other spider I see in and around my house,"" she said, ""is welcome to set up camp."" Editor's note: A version of this story was last published in 2023. Eric Lagatta covers breaking and trending news for USA TODAY. Reach him at elagatta@gannett.com",https://eu.usatoday.com/story/news/nation/2024/10/29/spiders-winter-homes-kill-pests/75552005007/
NASA identifies 9 possible landing spots for 2026 mission returning humans to the moon,"NASA plans to bring humankind back to the moon but first needs to figure out exactly where to land. The space agency has outlined nine potential lunar landing sites for its Artemis III mission, the agency's first planned return to the moon in over five decades. The mission, slated for 2026, intends to land near the lunar South Pole, where astronauts will visit unexplored areas, according to NASA. The nine regions selected are areas where crew can safely land to help uncover new discoveries and better grasp how to live on the lunar surface, according to NASA. The agency has not determined a priority ranking for the selected regions. During the selection process experts considered terrain suitability, launch window availability, lighting conditions, science potential and communication capabilities with Earth, among other factors. NASA officials also considered the combined trajectory capabilities of its Space Launch System rocket, the Orion spacecraft and Starship Human Landing System. ""The Moon’s South Pole is a completely different environment than where we landed during the Apollo missions,"" Artemis lunar science lead Sarah Noble said in a statement. ""It offers access to some of the Moon’s oldest terrain, as well as cold, shadowed regions that may contain water and other compounds. Any of these landing regions will enable us to do amazing science and make new discoveries."" NASA has selected nine potential landing regions, each with its diverse geological characteristics and flexibility for mission landing. Each spot is in the lunar South Pole, which has never been explored in a crewed mission and features permanently shadowed areas that can preserve resources like water. The following lunar sites have been considered: The last human to land on the moon was on Dec. 19, 1972, during NASA's Apollo 17 mission. The astronauts on that mission were the last to visit the moon and the last to travel more than 400 miles from the Earth, according to the National Space Air and Space Museum. Humankind first touched down on the moon on July 20, 1969, during the Apollo 11 mission in which Neil Armstrong became the first man to step foot on the moon. Artemis III, which will send two astronauts to the surface of the moon, is scheduled for September 2026. Artemis II, which will send astronauts around the moon, is slated for September 2025.",https://eu.usatoday.com/story/news/nation/2024/10/29/moon-landing-nasa-artemis-iii-mission/75907276007/
"Tennessee man pleads guilty to killing Eliza Fletcher, a mom of 2 jogging in Memphis","A Tennessee man pleaded guilty Monday to kidnapping and killing Memphis mother Eliza Fletcher during her morning jog in 2022. Cleotha Abston, 40, was able to avoid the death penalty with the guilty plea to first-degree murder and will face life in prison without the possibility of parole. Fletcher, who was 34 at the time of her death, was abducted while out on a run in the early hours of Sept. 2, 2022. Her body was not found until three days later. ""No legal resolution and no sentence can diminish the anguish of Liza's murder,"" Fletcher's family said in a statement sent to the news media. ""We accept the outcome that her murderer has pled guilty to all charges, will wake up in prison for the rest of his life and cannot harm anyone else. We are very grateful for the determination and professionalism of law enforcement and the district attorney's office."" Abston was arrested on Sept. 3, 2022, a day after Fletcher's abduction launched a multi-day, multi-agency manhunt across Memphis. He was initially charged with especially aggravated kidnapping and tampering with evidence. Footage from the University of Memphis campus, where Fletcher was taken while on a morning run, showed someone in a dark SUV approach Fletcher and force her into the vehicle after a brief struggle. First-degree murder and first-degree murder in perpetration of a kidnapping charges were added to Abston's case a day after Fletcher's remains were found. Abston pleaded guilty to Fletcher's killing to avoid the death penalty, his attorney, Juni Ganguli, told USA TODAY. Ganguli and attorney Lauren Pasley both advised Abston to plead guilty due to the mounting evidence against him. Ganguli added that a jury would have likely imposed the death penalty during a sentencing hearing. ""I've had other death penalty cases where the prosecution had agreed to sentences of life without parole following the guilt phase of trials,"" Ganguli said in his statement. ""There was overwhelming publicity and public outcry in this case."" Abston was convicted of a 2021 rape over six months before entering the plea on Monday. That rape went unsolved until DNA taken in a rape kit matched Abston. The trial spanned three days in April, when Abston was indicted for three different counts, aggravated rape, especially aggravated kidnapping and being a convicted felon in possession of a firearm. The jury convicted him of aggravated rape and convicted felon in possession of a handgun, and found him guilty of the lesser charge of aggravated kidnapping. Fletcher was the mother of two children and a teacher at St. Mary's Episcopal School. Before working joining St. Mary's, she taught Kindergarten at Promise Academy in Nashville and also coached soccer. In 2006, she graduated from Hutchison School in Memphis, according to the all-girl's school's website, and later earned a bachelor's degree in exercise science at Baylor University. She earned her masters of art in teaching with an emphasis in elementary education at Belmont University, according to a post from St. Mary's. She is also remembered as an avid runner, having run completed the St. Jude marathon in Memphis with a time of 3:26:09. She finished 22nd place out of all the women running the St. Jude marathon that year. Her placement allowed her to qualify for the elite Boston Marathon. George Robertson, the senior pastor at Second Presbyterian Church, said Fletcher was ""full of life."" She married Richard Fletcher III at the church in 2014, according to a 2015 report by Memphis Magazine. The couple shared two sons. ""She and her husband Ritchie are both very active and great leaders in our congregation,"" Robertson told the Commercial Appeal, part of the USA TODAY Network. ""They have two little boys who have come up to me every week and give me a hug."" In a statement, her family addressed Abston: ""We have no idea what happened to you to turn you into someone so filled with a desire to hurt people. Whatever it was, it does not excuse or explain what you have done. You have changed our lives forever, and nothing will ever be the same,"" they said. ""Your actions were evil. There is no other word for it. You murdered Liza, even though she did nothing to deserve it.""",https://eu.usatoday.com/story/news/nation/2024/10/28/cleotha-abston-guilty-plea-eliza-fletcher/75904708007/
Cold case: 'Lake Lady Jane Doe' identified 38 years after body found in Louisiana lake,"On June 19, 1986, a fisherman found a woman's body floating in a lake in southeastern Louisiana. For nearly four decades, the unidentified homicide victim was only known by the name ""Lake Lady Jane Doe"" until last week, when the St. Tammany Parish Sheriff’s Office in Covington announced new DNA technology had identified the victim. The sheriff's office said that the woman had been identified as 33-year-old Pamela Lee Hupp. As of Monday, Hupp's killer's identity remained unknown, the sheriff's office told USA TODAY. After Hupp's remains were discovered in Lake Pontchartrain near Slidell, about 30 miles northeast of New Orleans, they were turned over to the St. Tammany Parish Coroner’s Office. Hupp's manner of death was ruled a homicide, coroner's spokesperson James Hartman told USA TODAY on Monday, and her death certificate showed she died as a result of asphyxia. Officials also said she was pregnant. At the time of the discovery, she was estimated to be 20 to 30 years old, according to Othram, the DNA lab that eventually helped identify Hupp. During the investigation, authorities reconstructed Hupp's skull, from which a photograph was captured and released to the public, the sheriff's office said. Her story was also included on a segment that aired on ""America's Most Wanted."" Years later, in September 2022, a grant paved the way for more DNA analysis and genealogy research in the case. Then in April 2023, Othram's efforts helped locate potential family members of the victim who later helped lead to her identity. Born in April 1958, her last known residence was in Fort Lauderdale, Florida. It was not immediately known what she was doing in Florida at the time of her killing or how she was killed. “I want to thank the many investigators over the years who worked on this case and sought out available resources and technology to identify and give a name to the victim,” Sheriff Randy Smith released in a statement after the victim's identity was released. “Our detectives will not stop working until they have identified and arrested the person(s) responsible for Ms. Hupp’s death.” Anyone with information about the case is asked to call the sheriff's office at (985) 898-2341 or Detective Winston Harbin at (985) 276-1355. Natalie Neysa Alund is a senior reporter for USA TODAY. Reach her at nalund@usatoday.com and follow her on X @nataliealund.",https://eu.usatoday.com/story/news/nation/2024/10/28/lake-pontchartrain-louisiana-body-pamela-lee-hupp/75894656007/
US Navy officially apologizes for bombarding a native Alaskan community in 1882,"The U.S. Navy made an official apology this week for the bombardment and near destruction of a native Alaskan village 142 years ago. Speaking Saturday in Angoon, Alaska, located about 100 miles south of the state capital of Juneau in the Tongass National Forest, Rear Adm. Mark Sucato, commander of Navy Region Northwest issued the apology on the 142nd anniversary of the attack, which happened on Oct. 26, 1882 and killed six children while leaving the village's surviving residents without food or shelter amid a harsh winter. “The Navy recognizes the pain and suffering inflicted upon the Tlingit people, and we acknowledge these wrongful actions resulted in the loss of life, the loss of resources, the loss of culture, and created and inflicted intergenerational trauma on these clans,” Sucato said at the ceremony, which was livestreamed by the Sealaska Heritage Institute. “The Navy takes the significance of this action very, very seriously and knows an apology is long overdue.” While many details of what caused the destruction at Angoon have been lost to time over the years, what is known is that it began with the accidental death of a Tlingit shaman, who was killed aboard a whaling ship by an exploding harpoon gun. According to the Naval Heritage and History Command, accounts from the time say members of the Tlingit tribe forced the whaling ship to shore and took multiple hostages from the crew, along with demanding a ransom of 200 blankets, prompting the call for help by local officials from the Navy. When the Navy arrived at Angoon, they proceeded to destroy the village − burning canoes, food stores, and homes − leaving six children dead and the survivors stranded, entirely dispossessed. The village received a $90,000 settlement in 1973, and in 1982 the Navy sent a letter to the Kootznoowoo Heritage Foundation acknowledging their role in the affair and writing that, ""The destruction of Angoon should never have happened, and it was an unfortunate event in our history."" The village, however, had long sought an official acknowledgement and apology for the event. ""Thank you, Angoon, for keeping our culture so and so strong,"" said Rosita Worl, president of the Sealaska Heritage Institute, at the ceremony. Last month, the Navy conducted a similar apology, for the burning and bombardment of the Tlingit village of Kake in 1869, according to Alaska Public Media. On Oct. 25, President Joe Biden became the first U.S. president to officially apologize for the abuses committed at Native American boarding schools for more than a century. Max Hauptman is a Trending Reporter for USA TODAY. He can be reached at MHauptman@gannett.com",https://eu.usatoday.com/story/news/nation/2024/10/28/navy-apology-alaska-angoon-village-tlingit-bombardment-1882/75896393007/
