title,content,url
"3 dead, 3 injured in shootings at Minneapolis homeless encampments: 'Cold-blooded killing'","Minneapolis police are investigating back-to-back fatal shootings over the weekend involving a half-dozen people at two separate homeless encampments in the city. As of Monday, no arrests had been made in the shootings that left a combined three people dead and a fourth person clinging to life. Meanwhile, Minneapolis Mayor Jacob Frey tied the shooting and other recent violence at encampments to the drug fentanyl. The Minneapolis Police Department reported the first shooting took place Saturday just before 4:45 a.m., at a homeless encampment about two miles southeast of downtown. At the scene, the agency wrote in a release, officers located three men injured by gunfire. The victims were transported to a local hospital where one of the men, age 31, died, police said. On Monday, police Sgt. Garrett Parten told USA TODAY the other two victims' conditions were not immediately known. Homicide investigators said they were investigating what led up to the shooting, including the possibility that three suspects who left the scene on foot. Investigators were also working to determine ""what connection the three injured men had with the encampment,"" police wrote in a release. As of Monday morning, the suspects had not been located. 'Home Improvement' star: Zachery Ty Bryan charged with DUI in Oklahoma The second shooting took place the next day in broad daylight at another encampment along railroad tracks five miles southeast of downtown, police said. That camp is about three-and-half miles southeast of the scene of the first triple shooting. During that shooting, which took place about 2:20 p.m., unknown suspects shot three people in the camp − two men and one woman. The men, age 32 and 38, were both pronounced dead at the scene. Parten said the woman was taken to a hospital to be treated for life-threatening injuries. On Sunday, police announced three people were detained after the second shooting, but were later cleared and released. They did not elaborate. Chief says police 'failed' victim: Minneapolis man accused of shooting neighbor arrested Police said they have not ruled out the possibility both shootings are related, and said the case − including a motive for the attacks − remained under investigation. “The cold-blooded killing of three people inside the tent of an encampment is outrageous,” police Chief Brian O’Hara released in a statement Sunday. “All human life matters and encampments are not safe."" The Hennepin County Medical Examiner will release the victims' identities and their official cause and manner of death, police said. USA TODAY has reached out to the medical examiner's office. During a Sunday press conference, Frey said Minneapolis has seen an increase in homicides and shootings around homeless encampments across the city. ""This is another incredibly tragic and situation... it's not a coincidence this happened at homeless encampments,"" Frey said. ""We need to call a spade a spade. This is not about a lack of shelter... the issues that we're seeing in terms of crime and violence (are) about fentanyl."" The drug, a potential deadly narcotic, is a synthetic opioid approved for treating pain often laced into cocaine and other illicit recreational drugs. In cases where a mixture of fentanyl and cocaine isn’t fatal, it could increase the likelihood that the user develops an addiction. Drug dealers use fentanyl as a cheap way to amp up the power of other drugs, Tom Doub, chief clinical and compliance officer at addiction treatment company American Addiction Centers, previously told The Tennessean, part of the USA TODAY Network. The drugs are cheap to make, which means they are cheaper to buy on the street. Minneapolis City Council Member Jason Chavez pushed back on Frey tying the violence to fentanyl, local media outlet KARE 11 reported, accusing the mayor of pushing blame onto the city council. 'We are seeing folks that get evicted from their rental units end up in shelters or at encampments. That is not a fentanyl issue,"" Chavez said, per the outlet, while calling for a ""housing-first model."" ""If you can move someone into a tiny home with services, with mental health support, addiction services, an opportunity to have a job and a place to sleep at night, the likelihood that they're going to move into a permanent place and be stable has increased. That model works. Let's do more of that in the city of Minneapolis,"" Chavez said, per KARE 11. O'Hara said the department continues to address crime related issues associated with homeless encampments and the city continues to offer resources. ""To help end this cycle of violence that is exacerbated by narcotics and mental health issues, it is crucial that the residents of these encampments accept the resourced that are available,"" O'Hara said. Natalie Neysa Alund is a senior reporter for USA TODAY. Reach her at nalund@usatoday.com and follow her on X @nataliealund.",https://eu.usatoday.com/story/news/nation/2024/10/28/minneapolis-homeless-encampment-shootings/75890765007/
Weather extremes in the forecast this week: What to expect from coast-to-coast,"Weather extremes are forecast from coast-to-coast this week as a cold front moves inland off the Pacific and a bout of potentially record-breaking heat spreads eastward, producing strong thunderstorms in the central U.S. as the temperatures clash, meteorologists say. Soaring temperatures could break decades-old temperature records early this week from Texas to Minnesota and Michigan as temperatures rise 15-25 degrees above their historical averages, according to AccuWeather. Widespread afternoon temperatures will be in the 70s and 80s, with some south-central states potentially reaching 90 degrees. The warm weather is projected to spread east by Wednesday, ratcheting up daily highs to potentially record levels throughout the Mid-Atlantic region and elevating the risk of wildfires. On Halloween, daily record temperatures – some dating back to the 1940s and 1950s – could be broken in major Northeast cities, including Pittsburgh, Philadelphia and New York City, according to AccuWeather. A factor in the east's rising temperatures is a lack of rainfall, which is on pace to make October the driest month on record in Philadelphia and New York City, neither of which has received measurable amounts of rainfall since September. The dry conditions combined with gusty winds approaching from the west will lead to a sustained risk of wildfires across the Northeast, prompting warnings from meteorologists. ""This time of year, many people are doing yardwork and burning leaves and other smaller twigs or perhaps having evening bonfires with family and friends. Extra precautions will need to be taken when participating in these kinds of activities due to the high fire danger and how quickly fires could spread,"" said Dan Pydynowski, a senior meteorologist with AccuWeather. ""It may be best to put off burning leaves and other yard waste until a change in the pattern brings wetter conditions with less wind."" As heat expands east, a cold front blowing in from the Rockies will alleviate high temperatures in the central U.S. but is expected to cause thunderstorms capable of flooding low-lying areas. The risk of storm outbreak will peak on Tuesday night across the south-central Plains and Upper Midwest, where ""strong to severe thunderstorms"" could produce damaging winds and hail, according to the National Weather Service. Through Wednesday and Thursday, forecasters expect rain to scuttle Halloween festivities in parts of the Ohio Valley and Great Lakes region, including major cities such as Detroit and Cleveland, according to AccuWeather. Thunderstorms may hamper holiday plans in the South, especially a swath of the region from Houston to Little Rock, Arkansas, and Memphis, Tennessee. Rain is also forecast across the eastern coast of the Florida Peninsula, from Daytona to Miami and the Florida Keys. Though the rain could cause flooding, damaging winds and hail are the main hazards through the midweek, meteorologists said. Beginning over the weekend, a series of storms pushing across the Northwest from the Pacific began to unload cool air, rain, strong winds and, at high elevations, snow. On Monday, showers and thunderstorms are expected along the Pacific coasts of Oregon and Washington, where there is a possibility of ""localized flooding, mainly in low-lying and poor drainage areas,"" according to AccuWeather Meteorologist Alyssa Glenny. The rain will extend into Tuesday across the Pacific Northwest and Northern California, the weather service said. As the storms roll into the interior states, they will trigger snowfall across the high terrain of Utah, Wyoming and Colorado, AccuWeather said. Snow amounts could exceed half a foot across the central Rockies. The cool air will bring relief to some western states. In Las Vegas, which has sweltered in recent days amid afternoon highs in the 80s, the storms are projected to drop temperatures into the 60s this week.",https://eu.usatoday.com/story/news/nation/2024/10/28/weekly-weather-forecast-record-heat-snow-thunderstorms/75889880007/
"Missing 53-year-old woman found stabbed, 'wrapped' in blanket and towel in Philadelphia garage","A 53-year-old woman who was reported missing was found dead in a garage in Philadelphia over the weekend, police said. On Sunday, the victim, identified as Ivelisse Lugo, was discovered ""wrapped in a blanket and towel with a stab wound to the back,"" a spokesperson for the Philadelphia Police Department told USA TODAY on Monday. First responders at the scene determined she was dead just before 4:30 p.m. ""The scene was secured; no arrest were made at this time, and no weapon was recovered,"" the spokesperson said in a statement. ""The investigation is active and ongoing with Homicide Detectives. "" Crime: Minneapolis man accused of shooting neighbor arrested; chief says police 'failed' victim According to the statement, officers initially responded to a report of a missing individual on Saturday. The next day, when they returned to the residence, they made the grim discovery. A motive was not immediately clear. The department is asking the public to contact them with any tips relating to this case. They are offering a $20,000 reward for information that results in an arrest and conviction, the spokesperson added. Tipsters can call or text 215-686-TIPS. Taylor Ardrey is a news reporter for USA TODAY. You can reach her at tardrey@gannett.com.",https://eu.usatoday.com/story/news/nation/2024/10/28/ivelisse-lugo-missing-woman-philadelphia/75890104007/
"1 dead, 1 critically injured after passengers were reportedly subway surfing in NYC","New York police are investigating after two passengers who were subway surfing Sunday fell between train cars, leaving 1 dead and 1 hospitalized. A person called the NYPD about the incident around 10:48 p.m. Sunday, the NYPD's Office of the Deputy Commissioner said Monday morning. The caller said a person had been hit by a train at the 111th Street subway station, part of the 115th Precinct, which includes a northern portion of Queens. According to the Office of the Deputy Commissioner, the southbound ""7"" train hit the female passengers. The office did not announce the ages of the passengers, but local television stations WNYW and WABC reported that they were teenagers. One of the passengers was pronounced dead at the scene while the other was taken to a hospital with trauma to the head, the Office of the Deputy Commissioner confirmed to USA TODAY. The second passenger was listed as being in critical condition. The girls got on the subway at the Flushing Main St. station, WABC reported, and were reportedly subway surfing, a trend where people ride on top of train cars. They were running on top of a moving subway as it headed west and had jumped between train cars. When the train stopped, the girls lost their balance and one of the girls fell under the train, the outlet reported. She also suffered a brain bleed, according to WABC. The outlet said the girls weren’t carrying identification, so police haven’t been able to notify their families. The identity of the deceased is pending at this time, the Office of the Deputy Commissioner said. Last year, five people died while subway surfing, reported WABC. The girl’s death is the sixth subway surfing death this year, according to WABC. Last week, a 13-year-old boy fell and died while subway surfing at the Forest Avenue subway station in Queens. The following day, a 20-year-old man died under similar circumstances, reported WNBC. Contributing: Saman Shafiq, USA TODAY Saleen Martin is a reporter on USA TODAY's NOW team. She is from Norfolk, Virginia – the 757. Follow her on Twitter at @SaleenMartin or email her at sdmartin@usatoday.com.",https://eu.usatoday.com/story/news/nation/2024/10/28/subway-surfing-nyc-death-injury/75891756007/
Minneapolis man accused of shooting neighbor arrested; chief says police 'failed' victim,"A Minnesota man suspected of shooting his neighbor while he was cutting a tree was arrested and charged early Monday morning. His neighbor reported him to police several times before the shooting, officials say. The suspect, John Herbert Sawchak, 54, is believed to have shot his neighbor, Davis Moturi, on Oct. 23 from inside his Minneapolis home while the victim was cutting a tree. The victim reported Sawchak several times before, including after Sawchak is said to have threatened to shoot the victim if he touched the same tree he was cutting when Wednesday's shooting occurred, according to Minneapolis Police Chief Brian O’Hara. When Moturi's wife got home, she believed her husband had suffered from a heart attack and Emergency Medical Services transported him to the hospital, O’Hara said during a press briefing Friday. There, medical personnel discovered he'd been shot. The victim could not remember what happened before he was found unconscious, including that fact that he was shot, O'Hara said. No witnesses were around at the time of the shooting. USA TODAY reached out to the Minneapolis Police Department. Sergeant Garrett Parten confirmed the victim's name and directed USA TODAY to the press briefing on YouTube for the latest information. Florida murder: Palm Beach County man, 21, faces murder charge in failed drug deal Sawchak was arrested peacefully Monday morning after a SWAT operation that lasted several hours. ""Minneapolis Police exhausted all of our efforts to peacefully bring the situation to resolution (prior) to escalating the use of force with a SWAT team and special tactics,"" said O'Hara. Sawchak was charged with the following felonies, according to the Hennepin County Sheriff's Department: The suspect is being held on a $1 million bail and is set to a court appearance on Tuesday at 1:30 p.m., according to the department's arrest records. The victim had also reported his neighbor several times before the shooting and made several 911 calls regarding Sawchak. He also reported his neighbor before when he threatened to shoot him if he touched a specific tree, according to O’Hara. ""We failed this victim,"" O’Hara said Sunday night. ""He should not have been shot."" When police responded to the calls, Sawchak refused to open the door and speak with officers, according to O’Hara. A lieutenant had gone to the suspect's house over 20 times. The number does not include the times other officers have been called to the address. This led to the lieutenant giving his phone number to the victim, said O’Hara. The lieutenant asked the victim to call him when he did see Sawchak leave his home. Before Sunday night, police had concerns over an altercation and wanted to arrest the suspect where he did not have access to his firearms, but O'Hara said the man was a ""recluse"" and did not leave his house often. The suspect, who O'Hara said was ""mentally ill,"" was known to possess firearms, had violent confrontations in the past and refused to cooperate in ""the dozens of times that police officers have responded to the residence."" The execution of the arrest warrant was deemed ""high-risk."" ""Based on our assessment, the likelihood of an armed, violent confrontation where we may have to use deadly force with the suspect in this case is high,"" said O'Hara during a press briefing on Friday. ""Prior to Wednesday, all we had was a threats warrant.""",https://eu.usatoday.com/story/news/nation/2024/10/28/minneapolis-police-arrest-john-herbert-sawchak-shooting-neighbor-tree/75889846007/
